{
  "schema_version": "1.0",
  "project_id": "buoycalc",
  "display_name": "BuoyCalc Windows controlled engineering",
  "repository": {
    "local_path": "C:\\workspace\\repos\\buoycalc-windows",
    "remote": "Gonoboben/buoycalc-windows",
    "default_branch": "main"
  },
  "authoritative_files": [
    "AGENTS.md",
    "docs/OPTIMIZATION_PLAN.md",
    "RELEASE.md"
  ],
  "policy_ref": "profiles/buoycalc-controlled-policy.json",
  "architecture_baseline": "BuoyCalc v1.0.0 frozen engineering baseline",
  "tool_profiles": [
    "buoycalc.dotnet_build",
    "buoycalc.selected_shape_consumer_scan",
    "buoycalc.report_store_consumer_scan",
    "buoycalc.validation_601"
  ]
}
